{"artifact_sha256":"c95b0e5f4fe5408fc66972ba1626232c60455f1cea4cb3b7d3bcfabc73885ff4","conflicts":[{"conflict_id":"rebound-evidence","decision":"adapt","impact":"脚本暂用“柔韧不变形”或补拍回弹，不写成确定性回弹承诺","owned_fact":"source-03能看到挤压不变形，但回弹释放瞬间不够清楚","reference_rule":"参考片把弯折/回弹作为卖点","resolution":"bridge"},{"conflict_id":"cta-identity","decision":"rewrite","impact":"只借鉴搜索型收尾机制，原创品牌和行动提示","owned_fact":"自有素材没有同类 CTA 画面和文案","reference_rule":"参考片使用品牌头像、账号和搜索词 CTA","resolution":"rewrite"},{"conflict_id":"reference-identity","decision":"keep_adapt","impact":"保持暖木/透明材质的可读性，换成自有场景和原创字卡","owned_fact":"自有素材是明亮家庭餐桌、无参考水印","reference_rule":"参考片人物、暖木桌、水印和字卡风格","resolution":"accept"}],"created_at":"2026-08-20T04:25:58.784493+00:00","differentiation_directions":[{"avoid":["复制参考人物、水印、品牌字样和原 CTA"],"change_for_project":["开场改用自有防刮/防油素材","口播围绕“怕刮花、难清洁”原创表达"],"direction_id":"direction-pain-first","industry_prior_refs":["short-video-hook-window@1.0","ecommerce-action-result-pair@1.0"],"keep_from_reference":["第一秒直接给动作","近景动作证明","短词字卡"],"matrix_row_refs":["matrix-03","matrix-04"],"prerequisites":["确认防刮或防油素材作为开场","原创前三秒字幕/口播"],"promise":"先用刮擦或油污动作把痛点放在前三秒，再快速给出透明保护层的解决结果。","title":"先让观众看到桌面风险","tradeoffs":["痛点更强，但产品整体铺开动作会后移"]},{"avoid":["把无证据的回弹写成确定性承诺","把检测画面等同于全部安全结论"],"change_for_project":["用4K自有素材替换参考主体","每镜只说一个卖点，字幕与动作同步"],"direction_id":"direction-proof-chain","industry_prior_refs":["ecommerce-action-result-pair@1.0","short-video-copy-density@1.0","ecommerce-product-readable@1.0"],"keep_from_reference":["卖点按动作逐段证明","中段密集节奏","结尾生活结果"],"matrix_row_refs":["matrix-01","matrix-02","matrix-03","matrix-04","matrix-06"],"prerequisites":["剪出动作-结果最清楚的区间","确定“柔软回弹”改为“柔韧不变形”或补拍"],"promise":"用自动铺开、贴合、防刮、防油四段动作证据，形成一条连续、可信、易剪的证明链。","title":"四段证据一条讲清楚","tradeoffs":["功能最完整，但信息密度最高，需严格控制字幕数量"]},{"avoid":["让 CTA 占用过长时间","照搬深色搜索卡和账号信息"],"change_for_project":["使用自有餐桌素材收尾","CTA 改为原创品牌/搜索/行动提示"],"direction_id":"direction-life-table","industry_prior_refs":["ecommerce-product-readable@1.0","short-video-hook-window@1.0"],"keep_from_reference":["功能证明后切回生活场景","暖木色和透明高光"],"matrix_row_refs":["matrix-01","matrix-03","matrix-04","matrix-06","matrix-07"],"prerequisites":["确认品牌 CTA 文案和视觉规范","生活场景画面保留足够可读停留"],"promise":"前半段用功能证据建立信任，后半段用真实餐桌证明透明、不遮纹理、能长期使用。","title":"把保护落回真实餐桌","tradeoffs":["更生活化、更像自己的片子，但前三秒需要额外强化动作"]}],"industry_prior_evaluations":[{"confidence":0.75,"evaluation":"建议前三秒出现动作和结果，但不规定必须使用哪一个卖点","fit":"适用","label":"行业提醒","observed":"参考片在0-1秒出现展开动作；自有自动铺开/防刮/防油均可形成可见钩子","prior_id":"short-video-hook-window@1.0"},{"confidence":0.85,"evaluation":"贴合、防刮、防油适合直接证明；柔软回弹应改写或补证据","fit":"部分适用","label":"行业提醒","observed":"防刮和防油素材均有动作与结果；回弹证据不完整","prior_id":"ecommerce-action-result-pair@1.0"},{"confidence":0.7,"evaluation":"成片建议一镜一个主要信息点，口播/字幕服务动作，不叠加未经证实的承诺","fit":"适用","label":"行业提醒","observed":"参考片使用短词贴纸，无可用口播；自有素材无花字","prior_id":"short-video-copy-density@1.0"},{"confidence":0.8,"evaluation":"可保留近景证据，同时用餐桌全景交代最终使用结果","fit":"适用","label":"行业提醒","observed":"自有素材为4K近景和生活场景，产品与动作清楚","prior_id":"ecommerce-product-readable@1.0"}],"input_hashes":{"breakdown":"bdb46993ca071216bb7c3fd6150f31ad608cd401f5328b52ba11296257911cf9","fingerprint":"ac55c4052bb20b08d38bef3e0232698b0faf1ea9354306c46a76c904f16e1e4b","matrix":"000f76a7aa322150667336ece3436398a65d6367fa5b45341bbebb5cb0babe50"},"producer":"research_synthesis@2.0","project_id":"table-mat-mix-v7","semantic_sha256":"49da21ce2278dc7856a6c2b31884fb639c68e4a675148e3a294da2ad4a974ba9","summary":"参考片值得借鉴的是“动作先行、连续证明、生活化收束”的组织方式；自有素材足以重建贴合、防刮、防油和餐桌结果，但“柔软回弹”和 CTA 需要改写或补证据。行业提醒只用于帮助判断，不替代画面事实。","version":"1.0"}